StartDate,EndDate,Status,IPAddress,Progress,Duration (in seconds),Finished,RecordedDate,ResponseId,RecipientLastName,RecipientFirstName,RecipientEmail,ExternalReference,LocationLatitude,LocationLongitude,DistributionChannel,UserLanguage,Q1,Q125,Q126_First Click,Q126_Last Click,Q126_Page Submit,Q126_Click Count,Q4,Q61_First Click,Q61_Last Click,Q61_Page Submit,Q61_Click Count,Q145,Q146_First Click,Q146_Last Click,Q146_Page Submit,Q146_Click Count,Q156,Q157_First Click,Q157_Last Click,Q157_Page Submit,Q157_Click Count,Q167,Q168_First Click,Q168_Last Click,Q168_Page Submit,Q168_Click Count,Q178,Q179_First Click,Q179_Last Click,Q179_Page Submit,Q179_Click Count,Q225,Q226_First Click,Q226_Last Click,Q226_Page Submit,Q226_Click Count,Q227,Q228_First Click,Q228_Last Click,Q228_Page Submit,Q228_Click Count,Q229,Q230_First Click,Q230_Last Click,Q230_Page Submit,Q230_Click Count,Q231,Q232_First Click,Q232_Last Click,Q232_Page Submit,Q232_Click Count,Q5_1,Q6_1,Q227,Q229,Q231,Q233,Q235,Q237,Q104,Q47,Q48,Q132,Q105,Q127,Q128,Q133,Q52,Q129,Q130,Q134,Q92,Q97,Q98,Q99,Q100,Q8_1,Q62_1,Q63_1,Q64_1,Q83_1,Q66_1,Q67_1,Q68_1,Q69_1,Q74_1,Q75_1,Q76_1,Q77_1,Q80_1,Q81_1,Q91,Q38,Q40_1,Carta1_DO_sasso,Carta1_DO_forbice,Carta1_DO_carta,Forbice1_DO_carta,Forbice1_DO_forbice,Forbice1_DO_sasso,Sasso1_DO_forbice,Sasso1_DO_sasso,Sasso1_DO_carta,Forbice2_DO_carta,Forbice2_DO_forbice,Forbice2_DO_sasso,Carta2_DO_carta,Carta2_DO_sasso,Carta2_DO_forbice,Sasso2_DO_sasso,Sasso2_DO_carta,Sasso2_DO_forbice,Forbice3_DO_forbice,Forbice3_DO_sasso,Forbice3_DO_carta,Carta3_DO_forbice,Carta3_DO_carta,Carta3_DO_sasso,Sasso3_DO_sasso,Sasso3_DO_carta,Sasso3_DO_forbice,Forbice4_DO_carta,Forbice4_DO_forbice,Forbice4_DO_sasso,Carta4_DO_forbice,Carta4_DO_carta,Carta4_DO_sasso,Sasso4_DO_sasso,Sasso4_DO_carta,Sasso4_DO_forbice,Forbice5_DO_sasso,Forbice5_DO_carta,Forbice5_DO_forbice,Carta5_DO_forbice,Carta5_DO_carta,Carta5_DO_sasso,Sasso5_DO_sasso,Sasso5_DO_carta,Sasso5_DO_forbice,Sasso6_DO_sasso,Sasso6_DO_carta,Sasso6_DO_forbice,Carta6_DO_forbice,Carta6_DO_carta,Carta6_DO_sasso,Forbice6_DO_forbice,Forbice6_DO_sasso,Forbice6_DO_carta,Sasso7_DO_sasso,Sasso7_DO_carta,Sasso7_DO_forbice,Carta7_DO_forbice,Carta7_DO_carta,Carta7_DO_sasso,Forbice7_DO_sasso,Forbice7_DO_carta,Forbice7_DO_forbice,Sasso8_DO_forbice,Sasso8_DO_sasso,Sasso8_DO_carta,Carta8_DO_carta,Carta8_DO_sasso,Carta8_DO_forbice,Forbice8_DO_carta,Forbice8_DO_forbice,Forbice8_DO_sasso,Carta9_DO_forbice,Carta9_DO_carta,Carta9_DO_sasso,Sasso9_DO_forbice,Sasso9_DO_sasso,Sasso9_DO_carta,Forbice9_DO_forbice,Forbice9_DO_sasso,Forbice9_DO_Q209,Sasso10_DO_forbice,Sasso10_DO_sasso,Sasso10_DO_carta,Carta10_DO_sasso,Carta10_DO_forbice,Carta10_DO_carta,Forbice10_DO_forbice,Forbice10_DO_sasso,Forbice10_DO_carta
Start Date,End Date,Response Type,IP Address,Progress,Duration (in seconds),Finished,Recorded Date,Response ID,Recipient Last Name,Recipient First Name,Recipient Email,External Data Reference,Location Latitude,Location Longitude,Distribution Channel,User Language,"Bentornat*, ti chiediamo di inserire un codice che ci permetterà di collegare le risposte che hai dato al precedente questionario con quelle che darai adesso.RIusa lo stesso codice composto dalla 1° e 2° lettera del tuo nome, dalla 1° e 2° lettera della tua città di nascita e i quattro numeri che compongono il tuo giorno e mese di nascita. Esempio: Marco da Vicenza 01/03/1990  = mavi0103",1. Scegli tra carta sasso o forbice per giocare a morra cinese:,Timing - First Click,Timing - Last Click,Timing - Page Submit,Timing - Click Count,2. Scegli tra carta sasso o forbice per giocare a morra cinese:,Timing - First Click,Timing - Last Click,Timing - Page Submit,Timing - Click Count,3. Scegli tra carta sasso o forbice per giocare a morra cinese:,Timing - First Click,Timing - Last Click,Timing - Page Submit,Timing - Click Count,4. Scegli tra carta sasso o forbice per giocare a morra cinese:,Timing - First Click,Timing - Last Click,Timing - Page Submit,Timing - Click Count,5. Scegli tra carta sasso o forbice per giocare a morra cinese:,Timing - First Click,Timing - Last Click,Timing - Page Submit,Timing - Click Count,6. Scegli tra carta sasso o forbice per giocare a morra cinese:,Timing - First Click,Timing - Last Click,Timing - Page Submit,Timing - Click Count,7. Scegli tra carta sasso o forbice per giocare a morra cinese:,Timing - First Click,Timing - Last Click,Timing - Page Submit,Timing - Click Count,8. Scegli tra carta sasso o forbice per giocare a morra cinese:,Timing - First Click,Timing - Last Click,Timing - Page Submit,Timing - Click Count,9. Scegli tra carta sasso o forbice per giocare a morra cinese:,Timing - First Click,Timing - Last Click,Timing - Page Submit,Timing - Click Count,10. Scegli tra carta sasso o forbice per giocare a morra cinese:,Timing - First Click,Timing - Last Click,Timing - Page Submit,Timing - Click Count,Secondo te il Computer forniva risposte a caso o in modo strategico? - .,Quanto hai modificato la tua strategia di gioco tra il primo e il secondo questionario? - Ho cambiato la mia strategia:,1. 10 lanci della moneta hanno prodotto il seguente risultato: CTTTCTTTCT,2. 10 lanci della moneta hanno prodotto il seguente risultato: TCCCCTTTCT,3. 10 lanci della moneta hanno prodotto il seguente risultato: CTCTCCCCCC,4. 10 lanci della moneta hanno prodotto il seguente risultato: TCTTCTTCCT,5. 10 lanci della moneta hanno prodotto il seguente risultato: CTTCCTTCTC,"Ora immagina che le sequenze che ti abbiamo presentato in precedenza siano 50 lanci consecutivi della stessa moneta, valuta nel complesso quanto casuali o predeterminati siano stati i risultati.",Quanto brutto o bello ritieni questo quadro?,Quanto familiare ti sembra questo quadro?,Pensi che l'opera sia stata generata in modo casuale?,Ti sembra che nel dipinto siano presenti dei pattern visivi o delle figure particolari?,Quanto brutto o bello ritieni questo quadro?,Quanto familiare ti sembra questo quadro?,Pensi che l'opera sia stata generata in modo casuale?,Ti sembra che nel dipinto siano presenti dei pattern visivi o delle figure particolari?,Quanto brutto o bello ritieni questo quadro?,Quanto familiare ti sembra questo quadro?,Pensi che l'opera sia stata generata in modo casuale?,Ti sembra che nel dipinto siano presenti dei pattern visivi o delle figure particolari?,Ho bisogno di stare sulla difensiva con gli/ altr*,Le persone cercano di farmi arrabbiare,Gli estranei/amici mi guardano in modo critico,Le persone ridono di me,I miei pensieri/azioni potrebbero essere controllati da altr*,"1. Il governo è coinvolto nell’assassinio di
cittadini innocenti e/o di famose figure pubbliche, e lo mantiene segreto - è probabile che questa affermazione sia vera","2.     Il potere detenuto dai capi di stato è
subordinato a quello di un gruppo sconosciuto che controlla realmente le
politiche mondiali - è probabile che questa affermazione sia vera","3.     Ci sono organizzazioni segrete che comunicano
con gli extraterrestri, ma tengono nascosto questo fatto alla popolazione - è probabile che questa affermazione sia vera","4.     La diffusione di alcuni virus e/o malattie è
il risultato di sforzi deliberati e nascosti di alcune organizzazioni. - è probabile che questa affermazione sia vera","5.     Gruppi di scienziati manipolano, fabbricano o
censurano evidenze allo scopo di ingannare la popolazione. - è probabile che questa affermazione sia vera","6.     Il governo permette o perpetra atti di
terrorismo sul proprio territorio, mascherando il suo coinvolgimento. - è probabile che questa affermazione sia vera","7.     Un piccolo gruppo segreto di persone è il
responsabile di tutte le maggiori decisioni mondiali, come il far scoppiare le
guerre - è probabile che questa affermazione sia vera","8.     La prova del contatto alieno è stata nascosta
alla popolazione - è probabile che questa affermazione sia vera","9.     Tecnologie con capacità di controllo mentale
sono usate sulle persone senza che lo sappiano - è probabile che questa affermazione sia vera","10.  Nuove ed avanzate tecnologie che
danneggerebbero l’attuale industria sono state soppresse - è probabile che questa affermazione sia vera","11.  Il governo usa persone come capri espiatori
per nascondere il suo coinvolgimento in attività criminali - è probabile che questa affermazione sia vera","12.  Alcuni fatti significativi sono stati il
risultato dell’attività di un piccolo gruppo che segretamente manipola eventi
mondiali - è probabile che questa affermazione sia vera","13.  Alcuni avvistamenti e dicerie sugli UFO sono
stati pianificati o messi in scena allo scopo di distrarre la popolazione dal
vero contatto alieno - è probabile che questa affermazione sia vera","14.  Esperimenti che coinvolgono nuovi farmaci o
tecnologie sono quotidianamente portati avanti alle spalle della popolazione,
senza il loro consenso - è probabile che questa affermazione sia vera","15.  Molte informazioni importanti sono
deliberatamente nascoste al pubblico per interessi personali - è probabile che questa affermazione sia vera",Genere,Età (in cifre),Come consideri il tuo orientamento politico?,Carta 1 - Display Order - sasso,Carta 1 - Display Order - forbice,Carta 1 - Display Order - carta,Forbice 1 - Display Order - carta,Forbice 1 - Display Order - forbice,Forbice 1 - Display Order - sasso,Sasso 1 - Display Order - forbice,Sasso 1 - Display Order - sasso,Sasso 1 - Display Order - carta,Forbice 2 - Display Order - carta,Forbice 2 - Display Order - forbice,Forbice 2 - Display Order - sasso,Carta 2 - Display Order - carta,Carta 2 - Display Order - sasso,Carta 2 - Display Order - forbice,Sasso 2 - Display Order - sasso,Sasso 2 - Display Order - carta,Sasso 2 - Display Order - forbice,Forbice 3 - Display Order - forbice,Forbice 3 - Display Order - sasso,Forbice 3 - Display Order - carta,Carta 3 - Display Order - forbice,Carta 3 - Display Order - carta,Carta 3 - Display Order - sasso,Sasso 3 - Display Order - sasso,Sasso 3 - Display Order - carta,Sasso 3 - Display Order - forbice,Forbice 4 - Display Order - carta,Forbice 4 - Display Order - forbice,Forbice 4 - Display Order - sasso,Carta 4 - Display Order - forbice,Carta 4 - Display Order - carta,Carta 4 - Display Order - sasso,Sasso 4 - Display Order - sasso,Sasso 4 - Display Order - carta,Sasso 4 - Display Order - forbice,Forbice 5 - Display Order - sasso,Forbice 5 - Display Order - carta,Forbice 5 - Display Order - forbice,Carta 5 - Display Order - forbice,Carta 5 - Display Order - carta,Carta 5 - Display Order - sasso,Sasso 5 - Display Order - sasso,Sasso 5 - Display Order - carta,Sasso 5 - Display Order - forbice,Sasso 6 - Display Order - sasso,Sasso 6 - Display Order - carta,Sasso 6 - Display Order - forbice,Carta 6 - Display Order - forbice,Carta 6 - Display Order - carta,Carta 6 - Display Order - sasso,Forbice 6 - Display Order - forbice,Forbice 6 - Display Order - sasso,Forbice 6 - Display Order - carta,Sasso 7 - Display Order - sasso,Sasso 7 - Display Order - carta,Sasso 7 - Display Order - forbice,Carta 7 - Display Order - forbice,Carta 7 - Display Order - carta,Carta 7 - Display Order - sasso,Forbice 7 - Display Order - sasso,Forbice 7 - Display Order - carta,Forbice 7 - Display Order - forbice,Sasso 8 - Display Order - forbice,Sasso 8 - Display Order - sasso,Sasso 8 - Display Order - carta,Carta 8 - Display Order - carta,Carta 8 - Display Order - sasso,Carta 8 - Display Order - forbice,Forbice 8 - Display Order - carta,Forbice 8 - Display Order - forbice,Forbice 8 - Display Order - sasso,Carta 9 - Display Order - forbice,Carta 9 - Display Order - carta,Carta 9 - Display Order - sasso,Sasso 9 - Display Order - forbice,Sasso 9 - Display Order - sasso,Sasso 9 - Display Order - carta,Forbice 9 - Display Order - forbice,Forbice 9 - Display Order - sasso,Forbice 9 - Display Order - Q209,Sasso 10 - Display Order - forbice,Sasso 10 - Display Order - sasso,Sasso 10 - Display Order - carta,Carta 10 - Display Order - sasso,Carta 10 - Display Order - forbice,Carta 10 - Display Order - carta,Forbice 10 - Display Order - forbice,Forbice 10 - Display Order - sasso,Forbice 10 - Display Order - carta
2021-04-11 07:12:16,2021-04-11 07:17:23,IP Address,2.37.51.136,100,306,True,2021-04-11 07:17:23,R_1gI5yg5vhD56b9r,,,,,45.37939453125,11.7816009521484,anonymous,EN,Atad16,,,,,,Carta,1.98,34.022,34.688,23,,,,,,,,,,,,,,,,,,,,,,,,,,,,,,,,,,,,,,,,,64,59,,,,,,,,Del tutto,Per niente,,,,,,Nè bello nè brutto,,,,Moltissimo,Moltissimo,Poco,Moltissimo,Moltissimo,10,10,10,10,10,10,10,7,4,5,6,6,6,5,,G,333,58,,,,,,,,,,,,,,,,,,,,,,,,,,,,,,,,,,,,,,,,,,,,,,,,,,,,,,,,,,,,,,,,,,,,,,,,,,,,,,,,,,,,,,,,,,
2021-04-11 17:59:54,2021-04-11 17:59:59,Survey Preview,,100,4,True,2021-04-11 17:59:59,R_3qEG3fdPRMpjdF6,,,,,45.4096069335938,11.8946990966797,preview,EN,,,,,,,,,,,,,,,,,,,,,,,,,,,,,,,,,,,,,,,,,,,,,,,,,,,,,,,,,,,,,,,,,,,,,,,,,,,,,,,,,,,,,,,,,,,,,,,,,,,,,,,,,,,,,,,,,,,,,,,,,,,,,,,,,,,,,,,,,,,,,,,,,,,,,,,,,,,,,,,,,,,,,,,,,,,,,,,,,,,,,,,,
2021-04-11 18:01:03,2021-04-11 18:01:21,Survey Preview,,100,17,True,2021-04-11 18:01:21,R_3r2FTkFMV0pSe8B,,,,,45.5050048828125,9.21989440917969,preview,EN,,,,,,,,,,,,,,,,,,,,,,,,,,,,,,,,,,,,,,,,,,,,,,,,,,,,,,,,,,,,,,,,,,,,,,,,,,,,,,,,,,,,,,,,,,,,,,,,,,,,,,,,,,,,,,,,,,,,,,,,,,,,,,,,,,,,,,,,,,,,,,,,,,,,,,,,,,,,,,,,,,,,,,,,,,,,,,,,,,,,,,,,
2021-04-11 18:02:06,2021-04-11 18:02:54,Survey Preview,,100,48,True,2021-04-11 18:02:55,R_2653FsboRKlaG4b,,,,,45.4096069335938,11.8946990966797,preview,EN,,,1.07,1.07,1.759,1,,0,0,1.358,0,,0,0,1.317,0,,0,0,1.354,0,,0,0,1.191,0,,0,0,1.152,0,,0,0,1.29,0,,0,0,1,0,,0,0,1.067,0,,0,0,1.211,0,,,,,,,,,,,,,,,,,,,,,,,,,,,,,,,,,,,,,,,,,,,,,,,,,,,,,,,,,,,,,,,,,,,,,,,,,,,,,,,,,,,,,,,,,,,,,,,,,,,,,,,,,,,,,,,,,,,,,,,,,,,,,,,,,,,,,
2021-04-11 18:06:41,2021-04-11 18:09:50,Survey Preview,,100,188,True,2021-04-11 18:09:51,R_3sulHxpKNagkmSJ,,,,,45.5050048828125,9.21989440917969,preview,EN,aria0103,Forbice,1.255,1.255,2.385,1,Sasso,0.429,0.429,2.66,1,Carta,1.179,1.179,2.33,1,Forbice,0.489,0.489,1.432,1,Forbice,0.765,0.765,1.829,1,Sasso,0.785,2.097,2.618,2,Sasso,1.611,1.611,2.692,1,Sasso,0.558,0.558,1.929,1,Sasso,0.869,0.869,2.125,1,Sasso,0.94,0.94,2.468,1,75,75,,,,,,,Bello,Del tutto,Moltissimo,Del tutto,Abbastanza bello,Moltissimo,Moltissimo,Moltissimo,Bello,Moltissimo,Moltissimo,,,,,,,5,10,,,,,,,,,,,,,,qwr,123,96,,,,,,1,,,,,,,,,,1,,,,,,,,1,,,,1,,,,,,,,,,,1,,,,,,,,1,,,,,,,,,,1,,,,,,,1,,,,,,,,,,,,,,1,,,,1,,,,,,,,
2021-04-12 09:13:07,2021-04-12 09:28:38,IP Address,176.247.170.16,100,931,True,2021-04-12 09:28:39,R_aVSq6MjHZraAh1f,,,,,45.6495971679688,11.7866973876953,anonymous,EN,RUIC0906,Carta,1.076,1.076,2.512,1,Sasso,0.565,0.565,1.433,1,Forbice,0.708,0.708,1.55,1,Sasso,0.562,0.562,1.42,1,Carta,2.218,2.218,4.539,1,Carta,1.264,1.264,2.131,1,Forbice,0.714,0.714,1.526,1,Carta,1.105,1.105,2.012,1,Forbice,0.935,0.935,1.77,1,Carta,0.894,0.894,1.751,1,100,,,,,,,,Brutto,Pochissimo,Del tutto,Per niente,Nè bello nè brutto,Per niente,Del tutto,Per niente,Molto brutto,Per niente,Del tutto,Per niente,Moltissimo,Moltissimo,Moltissimo,Moltissimo,Moltissimo,10,6,6,6,7,6,5,6,7,8,9,9,8,9,10,SONO GABRIEL,2E+028,24,,,1,,,,,,,,,,,,,1,,,,1,,,,,,,,,,,,,,1,,,,,,,1,,1,,,,,,,,1,,,,,,,,,,,1,,,,,,,1,,,,,,,,,,,1,,,,,,,1,,,
2021-04-12 12:02:43,2021-04-12 12:07:17,IP Address,87.5.40.248,100,274,True,2021-04-12 12:07:17,R_1GK2gxyG8L77ojY,,,,,46.5018005371094,11.3471069335938,anonymous,EN,ieov0612,Forbice,2.469,2.469,3.381,1,Forbice,1.814,1.814,3.051,1,Carta,0.567,0.567,1.269,1,Forbice,1.171,1.171,1.769,1,Sasso,0.701,0.701,1.442,1,Carta,0.373,0.373,1.175,1,Sasso,0.354,0.354,1.083,1,Forbice,0.497,0.497,1.229,1,Sasso,0.155,0.155,0.912,1,Sasso,0.231,0.231,0.802,1,100,62,Completamente casuali,Completamente casuali,Completamente casuali,Completamente casuali,Completamente casuali,Completamente casuali,Brutto,Pochissimo,Abbastanza,Per niente,Brutto,Pochissimo,Abbastanza,Per niente,Brutto,Pochissimo,Abbastanza,Per niente,Per nulla,Per nulla,Per nulla,Per nulla,Per nulla,0,0,0,0,0,1,0,0,0,1,1,0,0,0,2,M,23,13,,,,1,,,,,,,1,,,,,,,,,,,,1,,,,,,1,,,,,,,,,,,,,,,,1,,,,,1,,,,,1,,,,,,,,,,,,,,,,,1,,,,1,,,,,,,,1,,,,,,
2021-04-12 12:03:03,2021-04-12 12:07:42,IP Address,151.42.175.79,100,279,True,2021-04-12 12:07:42,R_1DG8lnxfPkq9H7o,,,,,44.0574951171875,12.5653076171875,anonymous,EN,usim2209,Forbice,6.576,6.576,8.817,1,Carta,3.971,3.971,6.098,1,Carta,1.24,1.24,3.226,1,Sasso,0.662,0.662,1.354,1,Forbice,0.544,0.544,1.161,1,Carta,0.454,0.454,1.151,1,Sasso,0.484,0.484,1.131,1,Sasso,0.51,0.51,1.233,1,Forbice,0.55,1.279,2.496,2,Carta,0.468,0.468,1.108,1,97,1,Completamente casuali,Completamente casuali,Completamente casuali,Completamente casuali,Completamente casuali,Completamente casuali,Bello,Molto,Abbastanza,Pochissimo,Nè bello nè brutto,Poco,Abbastanza,Pochissimo,Nè bello nè brutto,Molto,Abbastanza,Pochissimo,Poco,Per nulla,Per nulla,Per nulla,Poco,0,0,0,0,1,1,0,0,1,0,1,1,0,0,0,femmina,32,27,,,,,,1,,,,,,,,1,,,,,,,,1,,,,,,,,,,,,,,1,,1,,,,,,,,,,,,,1,,,,,1,,,,,,,,1,,,,,,,,,,,,,,,1,,,,,,1,,,,,
2021-04-12 12:03:13,2021-04-12 12:08:01,IP Address,62.18.136.92,100,287,True,2021-04-12 12:08:01,R_s7Dq6hzpXG5Nh5L,,,,,45.5500030517578,10.25,anonymous,EN,omal1204,Sasso,1.135,1.499,2.351,2,Sasso,0.517,0.517,0.897,1,Sasso,0.467,0.467,0.849,1,Sasso,0.377,0.377,0.759,1,Sasso,0.403,0.403,0.836,1,Sasso,0.265,0.265,0.743,1,Sasso,0.365,0.365,0.799,1,Sasso,0.317,0.317,0.718,1,Sasso,0.335,0.335,0.792,1,Sasso,0.332,0.332,0.763,1,100,88,Molto casuali,Molto casuali,Molto casuali,Molto casuali,Molto casuali,Molto casuali,Nè bello nè brutto,Poco,Abbastanza,Per niente,Brutto,Per niente,Molto,Poco,Nè bello nè brutto,Abbastanza,Poco,Poco,Poco,Per nulla,Per nulla,Poco,Per nulla,0,0,0,0,0,0,0,0,0,4,0,0,0,3,3,M,25,35,,,,,,,1,,,,,,,,,,1,,,,,,,,,,1,,,,,,,,,1,,,,,,,,1,,,,1,,,,,,,,,1,,,,,,,1,,,,,,,,,,,,,1,,,,,,1,,,,,,,
2021-04-12 12:03:21,2021-04-12 12:08:30,IP Address,37.117.74.124,100,308,True,2021-04-12 12:08:30,R_sNVX8oniN4WU57b,,,,,45.4096069335938,11.8946990966797,anonymous,EN,LARE0602,Carta,6.427,7.656,9.232,2,Carta,3.066,3.066,4.322,1,Forbice,1.063,1.063,1.632,1,Forbice,1.531,1.531,2.505,1,Sasso,0.97,0.97,1.833,1,Sasso,2.136,2.136,2.841,1,Carta,0.661,0.661,1.375,1,Forbice,1.776,1.776,2.467,1,Sasso,1.384,1.384,2.029,1,Sasso,0.626,0.626,1.432,1,100,9,Completamente casuali,Completamente casuali,Completamente casuali,Completamente casuali,Completamente casuali,Completamente casuali,Bello,Pochissimo,Per niente,Abbastanza,Molto brutto,Per niente,Pochissimo,Molto,Molto bello,Pochissimo,Molto,Pochissimo,Molto,Per nulla,Poco,Per nulla,Per nulla,2,,,2,3,10,1,,,1,10,1,,6,9,Femmina,24,21,,1,,,,,,,,,,,,,1,,,,1,,,,,,,,,1,,,,,,,,,,,,,,,,1,,,1,,,,,,,,,,,,,1,,,,,,,,,,1,,,,,,,1,,,,,,,1,,,,,,
2021-04-12 12:03:24,2021-04-12 12:08:41,IP Address,147.162.110.41,100,317,True,2021-04-12 12:08:42,R_1gjNM1OixjAeWut,,,,,45.4096069335938,11.8946990966797,anonymous,EN,leas0810,Carta,1.783,1.783,3.292,1,Carta,1.101,1.101,2.378,1,Carta,1.014,1.014,2.451,1,Carta,1.008,1.008,2.413,1,Carta,1.086,1.086,2.571,1,Carta,1.478,1.478,3.094,1,Carta,0.911,0.911,2.593,1,Carta,1.19,1.19,3.011,1,Carta,0.941,0.941,2.688,1,Carta,0.957,0.957,3.327,1,100,,Completamente casuali,Completamente casuali,Completamente casuali,Completamente casuali,Completamente casuali,Completamente casuali,Abbastanza bello,Moltissimo,Poco,Per niente,Abbastanza bello,,Abbastanza,Pochissimo,Bello,Abbastanza,Molto,Pochissimo,Poco,Poco,Abbastanza,Poco,Per nulla,,,,,,,,,,,,,,,,Maschio,25,27,1,,,,,,,,,,,,,,1,,,,,,,,1,,,,,,,,1,,,,,,,,,1,,,1,,,,,,,1,,,,,,,,,1,,,,,,,,,1,,,,,,1,,,,,,,,,,,,1,,,,
2021-04-12 12:03:19,2021-04-12 12:08:49,IP Address,93.37.210.98,100,330,True,2021-04-12 12:08:50,R_eaFMGwJeVM1UqTD,,,,,45.4936981201172,12.2449951171875,anonymous,EN,LBAS0309,Carta,2.105,2.105,2.986,1,Sasso,0.66,0.66,1.254,1,Forbice,0.572,0.572,1.105,1,Forbice,1.944,1.944,2.571,1,Carta,0.649,0.649,1.559,1,Sasso,0.539,0.539,1.152,1,Sasso,0.603,1.167,1.678,2,Carta,1.622,1.622,2.281,1,Forbice,1.472,2.17,2.794,2,Sasso,0.987,0.987,1.509,1,50,69,Abbastanza casuali,Abbastanza casuali,Molto casuali,Molto casuali,Molto casuali,Abbastanza casuali,Molto bello,Abbastanza,Poco,Poco,Bello,Abbastanza,Poco,Abbastanza,Bello,Abbastanza,Abbastanza,Abbastanza,Abbastanza,Poco,Abbastanza,Poco,Abbastanza,7,2,3,1,1,2,1,2,1,2,1,1,1,3,4,Maschio ,23,32,,,1,,,,,,,,,,,,,1,,,,1,,,,,,,,,,1,,,,,,,,,,,1,,1,,,,,1,,,,,,,1,,,,,,,,,,,,1,,,,,,,,,,,,1,,,,,1,,,,,,
2021-04-12 12:02:51,2021-04-12 12:08:50,IP Address,37.160.42.213,100,358,True,2021-04-12 12:08:50,R_1U4UCQptpukZTdn,,,,,43.1479034423828,12.1096954345703,anonymous,EN,ERRE1204,Carta,1.077,1.077,2.5,1,Sasso,1.002,1.002,1.701,1,Forbice,2.2,2.852,3.492,2,Sasso,0.802,0.802,1.489,1,Carta,0.502,0.502,1.188,1,Forbice,0.899,0.899,1.425,1,Sasso,0.402,0.402,1.145,1,Forbice,0.802,0.802,1.594,1,Carta,0.501,0.501,1.252,1,Carta,0.503,2.295,8.404,3,74,0,Completamente casuali,Completamente casuali,Completamente casuali,Completamente casuali,Completamente casuali,Completamente casuali,Bello,Del tutto,Moltissimo,Per niente,Brutto,Per niente,Abbastanza,Poco,Bello,Moltissimo,Del tutto,Per niente,Molto,Per nulla,Per nulla,Per nulla,Molto,,,,,,,,,,,0,0,,,,Femmine,23,47,,,1,,,,,,,,,,,,,,1,,1,,,,,,,,,,,,,,,,,1,,,,1,,,1,,,,,,,,,1,,,1,,,,,,,,,,,,,,,1,,,,1,,,,,,,,,,,,,1,,,
2021-04-12 12:02:55,2021-04-12 12:09:15,IP Address,147.162.110.41,100,379,True,2021-04-12 12:09:15,R_1hMdQdXADpor1Ku,,,,,45.4096069335938,11.8946990966797,anonymous,EN,auad1307,Carta,2.101,2.101,3.037,1,Forbice,1.081,1.081,1.797,1,Sasso,0.574,0.574,1.529,1,Forbice,0.676,0.676,1.199,1,Carta,0.301,0.301,0.885,1,Sasso,0.676,0.676,1.426,1,Forbice,0.402,0.402,1.289,1,Carta,0.302,0.302,1.14,1,Sasso,0.482,0.482,0.999,1,Forbice,0.301,0.301,0.801,1,30,29,Abbastanza casuali,Nè casuali nè predeterminati,Abbastanza predeterminati,Nè casuali nè predeterminati,Abbastanza predeterminati,Abbastanza predeterminati,Nè bello nè brutto,Abbastanza,Pochissimo,Pochissimo,Abbastanza brutto,Poco,Pochissimo,Poco,Nè bello nè brutto,Molto,Poco,Poco,Abbastanza,Per nulla,Per nulla,Poco,Per nulla,1,0,1,0,0,0,0,5,0,0,0,0,5,0,5,Femmina,22,31,,,1,,,,,,,1,,,,,,,,,,,,,,,,1,,,1,,,,,,,,,,,,,1,1,,,,,1,,,,,,,,,,,,,,,1,,,,,,1,,,,,,,,,1,,,,,,,,,,,,1
2021-04-12 12:02:59,2021-04-12 12:09:27,IP Address,5.90.116.74,100,387,True,2021-04-12 12:09:27,R_3NKtuskdh4izyFX,,,,,43.54150390625,11.1766052246094,anonymous,EN,auir2307,Carta,5.847,5.847,6.634,1,Forbice,1.601,1.601,2.502,1,Sasso,1.214,1.214,2.117,1,Carta,0.898,0.898,1.643,1,Forbice,0.502,0.502,1.088,1,Sasso,0.681,0.681,1.513,1,Carta,0.401,0.401,1.223,1,Sasso,2.901,2.901,3.426,1,Forbice,0.612,0.612,1.109,1,Forbice,0.966,0.966,1.433,1,79,32,Completamente casuali,Completamente casuali,Completamente casuali,Completamente casuali,Completamente casuali,Completamente casuali,Abbastanza brutto,Per niente,Abbastanza,Molto,Brutto,Per niente,Abbastanza,Pochissimo,Abbastanza bello,Abbastanza,Abbastanza,Per niente,Poco,Poco,Poco,Poco,Per nulla,,0,,1,,2,3,,,6,2,,,,6,Femmina,22,21,1,,,,,,,,,,1,,,,,,,,,,,,,,,,1,,,,,1,,,,,,,1,,,,,,,,1,,,,,,,,,,,1,,,,,,,1,,,,,,,,,,,,,,,,1,,,,,,,1,,
2021-04-12 12:02:54,2021-04-12 12:09:41,IP Address,2.36.159.98,100,407,True,2021-04-12 12:09:41,R_29mDHJE9meV7LRW,,,,,45.6880950927734,9.72479248046875,anonymous,EN,aran0601,Carta,3.767,3.767,4.887,1,Sasso,1.242,1.242,2.576,1,Forbice,1.211,1.211,2.356,1,Forbice,1.256,1.256,2.549,1,Forbice,1.089,1.089,2.292,1,Sasso,1.253,1.253,2.398,1,Carta,1.147,1.147,2.496,1,Sasso,1.164,1.164,2.292,1,Forbice,0.857,0.857,2.227,1,Carta,1.338,1.338,2.552,1,80,90,Completamente casuali,Completamente casuali,Completamente casuali,Completamente casuali,Completamente casuali,Molto casuali,Nè bello nè brutto,Pochissimo,Abbastanza,Pochissimo,Brutto,Per niente,Pochissimo,Pochissimo,Nè bello nè brutto,Poco,Abbastanza,Pochissimo,Abbastanza,Poco,Abbastanza,Abbastanza,Poco,4,0,0,2,6,4,,,4,1,1,,,,5,femmina,25,76,,1,,,,,,,,,,,,,,,1,,,,1,,,,,,,1,,,,,,,,,1,,,,,,,,,1,,,,,,,,,,,,1,,,,,,,,1,,,,,,,,,,,,,,1,,,,,1,,,,,
2021-04-12 12:02:52,2021-04-12 12:10:06,IP Address,151.36.37.1,100,433,True,2021-04-12 12:10:06,R_tFJZd1lQDrfbtgB,,,,,45.5050048828125,9.21989440917969,anonymous,EN,lbor0902,Forbice,4.757,4.757,6.148,1,Sasso,2.966,2.966,4.066,1,Sasso,1.068,1.068,2.207,1,Sasso,2.271,2.271,3.387,1,Forbice,2.319,2.319,3.198,1,Forbice,2.021,2.021,3.034,1,Forbice,1.658,1.658,2.785,1,Sasso,2.435,2.435,3.956,1,Forbice,1.131,1.131,2.309,1,Carta,0.309,1.733,2.685,3,100,50,Molto casuali,Completamente casuali,Molto predeterminati,Completamente casuali,Completamente casuali,Completamente casuali,Brutto,Abbastanza,Molto,Per niente,Brutto,Poco,Pochissimo,Abbastanza,Abbastanza brutto,Abbastanza,Molto,Pochissimo,Poco,Per nulla,Poco,Poco,Per nulla,3,0,1,0,1,1,0,1,0,0,2,0,0,0,1,maschile,25,17,,,,1,,,,,,,,,,,,,1,,,,,,,,1,,,,,,,,,,,1,,,1,,,,,,,,,,,,,1,,,,,,,,,,1,,,1,,,,,,,,,,,,,,,,1,,,,,,1,,,
2021-04-12 12:02:30,2021-04-12 12:10:13,IP Address,2.34.190.253,100,462,True,2021-04-12 12:10:14,R_xbih2C8EdmEEA8N,,,,,44.6753997802734,11.0397033691406,anonymous,EN,iaol2012,Carta,4.861,4.861,5.931,1,Sasso,6.726,6.726,7.819,1,Forbice,6.301,6.301,7.334,1,Carta,0.861,0.861,1.63,1,Carta,0.501,0.501,1.411,1,Forbice,3.009,4.1,4.926,3,Sasso,0.861,0.861,1.681,1,Carta,0.611,0.611,1.514,1,Forbice,0.531,0.531,1.374,1,Sasso,0.577,0.577,1.214,1,60,92,Completamente casuali,Completamente casuali,Completamente casuali,Completamente casuali,Completamente casuali,Completamente casuali,Nè bello nè brutto,Moltissimo,Abbastanza,Per niente,Nè bello nè brutto,Poco,Abbastanza,Pochissimo,Nè bello nè brutto,Abbastanza,Abbastanza,Abbastanza,Poco,Per nulla,Abbastanza,Poco,Per nulla,1,1,1,1,1,0,1,0,1,2,1,1,1,2,3,M,25,25,1,,,,,,,,,,,,,,,,,1,,1,,,,,,,,,,,1,,,,,,,,,,1,,1,,,,,,,,,1,,,1,,,,,,,,,,,,1,,,,,,,,,,,,,,1,1,,,,,,,,
